{
    "$schema": "http://json-schema.org/draft-07/schema#",
    "id": "tbd",
    "title": "Site assessment calculation",
    "type": "object",
    "definitions": {
        "coordinates": {
            "type": "object",
            "properties": {
                "Latitude": {
                    "type": "number"
                },
                "Longitude": {
                    "type": "number"
                }
            },
            "required": [
                "Latitude",
                "Longitude"
            ]
        },
        "obstacle-base": {
            "type": "object",
            "properties": {
                "name": {
                    "type": "string"
                },
                "coordinates": { "$ref": "#/definitions/coordinates" }
            },
            "required": [
                "name",
                "coordinates"
            ]
        },
        "WTG": {
            "allOf": [
                { 
                    "$ref": "#/definitions/obstacle-base" 
                },
                {
                    "properties": {
                        "hub-height": {
                            "title": "Hub height",
                            "description": "Height of the centre of the swept area of the wind turbine rotor above the ground at the tower in meters.",
                            "type": "number"
                        },
                        "rotor-diameter": {
                            "title": "Rotor diameter",
                            "description": "Diameter of the rotor in meters.",
                            "type": "number"
                        }
                    },
                    "required": [
                        "hub-height",
                        "rotor-diameter"
                    ]
                }
            ]
        },
        "WME": {
            "allOf": [
                {
                    "$ref": "#/definitions/obstacle-base" 
                }
            ]
        },
        "WTG-obstacle": {
            "allOf": [
                { 
                    "$ref": "#/definitions/WTG" 
                },
                {
                    "properties": {
                        "in-operation": {
                            "title": "Operating status",
                            "description": "If false, the WTG will be treated as a simple obstacle.",
                            "type": "boolean",
                            "default": true
                        },
                        "tower-base-diameter": {
                            "title": "Tower diameter",
                            "description": "Diameter of the tower base in meters.",
                            "type": "number"
                        }
                    },
                    "required": [
                        "in-operation",
                        "tower-base-diameter"
                    ]
                }
            ]
        },
        "other-obstacle": {
            "allOf": [
                { 
                    "$ref": "#/definitions/obstacle-base" 
                },
                {
                    "properties": {
                        "height": {
                            "type": "number"
                        },
                        "width": {
                            "type": "number"
                        }
                    },
                    "required": [
                        "height",
                        "width"
                    ]
                }
            ]
        }
    },
    "properties": {
        "WME": { "$ref": "#/definitions/WME" },
        "WTG": { "$ref": "#/definitions/WTG" },
        "WTG-obstacle-set": {
            "type": "array",
            "items": { "$ref": "#/definitions/WTG-obstacle" }
        },
        "other-obstacle-set": {
            "type": "array",
            "title": "",
            "items": { "$ref": "#/definitions/other-obstacle" }
        }
    },
    "required": [
        "WME",
        "WTG",
        "WTG-obstacle-set",
        "other-obstacle-set"
    ]
}