{
    "WME": {
        "name": "met mast",
        "coordinates": {
            "Latitude": 53.554582,
            "Longitude": 8.622380
        }
    },
    "WTG": {
        "name": "AD5-135 (Lehe-3)",
        "hub-height": 130,
        "rotor-diameter": 135,
        "coordinates": {
            "Latitude": 53.550781,
            "Longitude": 8.622744
        }
    },
    "WTG-obstacle-set": [
        {
            "name": "AD5-116 (Lehe-1)",
            "hub-height": 110,
            "rotor-diameter": 116,
            "tower-base-diameter": 5,
            "in-operation": false,
            "coordinates": {
                "Latitude": 53.561207,
                "Longitude": 8.622948
            }
        },
        {
            "name": "AD5-116 (Lehe-2)",
            "hub-height": 110,
            "rotor-diameter": 116,
            "tower-base-diameter": 5,
            "in-operation": true,
            "coordinates": {
                "Latitude": 53.556630,
                "Longitude": 8.624490
            }
        },
        {
            "name": "Senvion 5M (1)",
            "hub-height": 120,
            "rotor-diameter": 126,
            "tower-base-diameter": 5,
            "in-operation": true,
            "coordinates": {
                "Latitude": 53.553858,
                "Longitude": 8.631728
            }
        },
        {
            "name": "Senvion 5M (2)",
            "hub-height": 120,
            "rotor-diameter": 126,
            "tower-base-diameter": 5,
            "in-operation": true,
            "coordinates": {
                "Latitude": 53.547983,
                "Longitude": 8.629427
            }
        },
        {
            "name": "Senvion 5M (3)",
            "hub-height": 120,
            "rotor-diameter": 126,
            "tower-base-diameter": 5,
            "in-operation": true,
            "coordinates": {
                "Latitude": 53.545727,
                "Longitude": 8.622660
            }
        },
        {
            "name": "Fictional small WTG",
            "hub-height": 20,
            "rotor-diameter": 10,
            "tower-base-diameter": 0.4,
            "in-operation": true,
            "coordinates": {
                "Latitude": 53.551357,
                "Longitude": 8.627901
            }
        }
    ],
    "other-obstacle-set": [
        {
            "name": "BEG",
            "height": 60,
            "width": 20,
            "coordinates": {
                "Latitude": 53.547847,
                "Longitude": 8.617918
            }
        }
    ]
}